{
    "exit_code":  0,
    "stderr_path":  "C:\\Codex_App_Factory/artifacts/ci-runs/CI-DEMO-001/stderr.log",
    "started_at":  "2026-07-17T15:24:57.7122197+08:00",
    "non_claims":  [
                       "local-ci-simulated is NOT a real CI provider",
                       "No cloud runner involved"
                   ],
    "artifact_paths":  [
                           "C:\\Codex_App_Factory/artifacts/ci-runs/CI-DEMO-001/stdout.log",
                           "C:\\Codex_App_Factory/artifacts/ci-runs/CI-DEMO-001/stderr.log"
                       ],
    "provider":  "local-ci-simulated",
    "commit_or_snapshot_ref":  "CODEX-FACTORY-V2-20260717",
    "job_name":  "products-api-regression",
    "status":  "PASS",
    "command":  "npm test",
    "stdout_path":  "C:\\Codex_App_Factory/artifacts/ci-runs/CI-DEMO-001/stdout.log",
    "finished_at":  "2026-07-17T15:24:59.5088363+08:00",
    "secret_policy_result":  "NOT_CHECKED",
    "command_redacted":  "npm test",
    "ci_run_id":  "CI-DEMO-001",
    "snapshot_verified":  true
}
